passenger,name,package,luggage,station,bureau,address
True,公庙子,False,False,True,呼和浩特铁路局,内蒙古自治区巴彦淖尔市乌拉特前旗先锋镇公庙子站
True,呼和浩特东站,True,True,True,呼和浩特铁路局,内蒙古自治区呼和浩特新城区南店呼和浩特东客站
True,临颍,False,False,True,郑州铁路局,河南省漯河市临颍县铁东路117号
True,灵宝,True,True,True,郑州铁路局,河南省灵宝市车站路1号
True,灵宝西,False,False,True,郑州铁路局,河南省灵宝市西闫乡
True,鲁山,True,True,True,郑州铁路局,河南省平顶山市鲁山县
True,洛阳,True,True,True,郑州铁路局,河南省洛阳市西工区道南路1号
True,洛阳东,False,False,True,郑州铁路局,河南省洛阳市瀍河区大同街38号
True,洛阳龙门站,False,False,True,郑州铁路局,河南省洛阳市洛龙区通衢路19号
True,爱河,False,False,False,哈尔滨铁路局,黑龙江省牡丹江室铁岭河镇
True,敖头,False,False,False,哈尔滨铁路局,黑龙江省海林市海南乡
True,八村,False,False,False,哈尔滨铁路局,黑龙江省大庆市大同区林源镇八村
True,八方,False,False,False,哈尔滨铁路局,黑龙江省讷河市六合镇八方车站
True,八虎力,False,False,False,哈尔滨铁路局,黑龙江省佳木斯市桦南县八虎力
True,白桦排,False,False,False,哈尔滨铁路局,黑龙江省大兴安岭地区加格达奇区白桦乡
True,白山乡,False,False,False,哈尔滨铁路局,黑龙江省龙江县白山乡白山乡车站
True,柳树泉,False,False,False,乌鲁木齐铁路局,新疆维吾尔自治区哈密市
True,七泉湖,False,False,False,乌鲁木齐铁路局,新疆维吾尔自治区吐鲁番地区七泉湖镇
True,山口,False,False,False,乌鲁木齐铁路局,新疆维吾尔自治区哈密市
True,五五,False,False,False,乌鲁木齐铁路局,新疆五五新镇
True,鱼儿沟,False,False,False,乌鲁木齐铁路局,新疆维吾尔自治区乌鲁木齐南山矿区
,,,,,,
True,阿图什,True,True,True,乌鲁木齐铁路局,新疆维吾尔自治区克孜勒苏柯尔克孜自治州阿图什市
True,巴楚,True,True,True,乌鲁木齐铁路局,新疆维吾尔自治区喀什地区巴楚县
True,北屯市,True,True,True,乌鲁木齐铁路局,新疆北屯市
True,博乐,False,False,True,乌鲁木齐铁路局,新疆博乐市
True,福海,False,False,True,乌鲁木齐铁路局,新疆阿勒泰地区福海县
True,哈密,True,True,True,乌鲁木齐铁路局,新疆维吾尔自治区哈密市
True,葆园,False,False,False,沈阳铁路局,吉林省龙井市老头沟镇桃园村
True,北磴,False,False,False,沈阳铁路局,辽宁省凌源市佛爷洞乡
True,北岗,False,False,False,沈阳铁路局,吉林省抚松县泉阳镇西顶子村
True,北台子,False,False,False,沈阳铁路局,内蒙古自治区赤峰市松山区穆家营子镇北台子村
False,北兴安,False,False,False,沈阳铁路局,内蒙古自治区阿尔山市兴安隧道
True,边沟,False,False,False,沈阳铁路局,辽宁省凤城市石城镇孟家村
True,渤海,False,False,False,沈阳铁路局,辽宁省盘锦市兴隆台区陈家乡
True,阿金,True,True,True,沈阳铁路局,辽宁省阜新市阜蒙县人民街
True,安广,True,True,True,沈阳铁路局,吉林省大安市安广镇
True,安平,False,False,True,沈阳铁路局,辽宁省辽阳市弓长岭区安平街道
True,安图,True,True,True,沈阳铁路局,吉林省安图县明月镇明安街187号
True,鞍山,True,True,True,沈阳铁路局,辽宁省鞍山市建国路1号
True,鞍山西,False,False,True,沈阳铁路局,辽宁省鞍山市千山区宁远镇太阳气村
True,敖力布告,False,False,True,沈阳铁路局,内蒙古自治区通辽市科左中旗代力吉镇
True,长坡岭,False,False,False,昆明铁路局,云南省曲靖市师宗县长坡岭火车站
True,车转湾,False,False,False,昆明铁路局,云南省富源县中安镇车转湾火车站
True,大苴,False,False,False,昆明铁路局,云南省姚安县弥兴镇大苴火车站
True,大田边,False,False,False,昆明铁路局,云南省曲靖市富源县古敢乡大田边火车站
True,大湾子,False,False,False,昆明铁路局,云南省楚雄州元谋县江边乡大湾子火车站
True,都格,False,False,False,昆明铁路局,贵州省六盘水市水城县都格镇垭口乡都格火车站
True,古东,False,False,True,太原铁路局,山西省古交市东曲街道办事处古东火车站
True,古交,False,False,True,太原铁路局,山西省古交市迎宾路1号
True,河边,False,False,True,太原铁路局,山西省定襄县河边镇河边四村
True,河津,True,True,True,太原铁路局,山西省河津市龙岗西路
True,甸心,False,False,True,昆明铁路局,云南省楚雄州禄丰县妥安乡甸心火车站
True,发耳,False,False,True,昆明铁路局,贵州省六盘水市水城县发耳乡发耳火车站
True,富源,False,False,True,昆明铁路局,云南省曲靖市富源县中安镇富源火车站
True,广通北,True,True,True,昆明铁路局,云南省楚雄州禄丰县广通镇广通北火车站
True,鹤庆,False,False,True,昆明铁路局,云南省大理州鹤庆县草海镇鹤庆火车站
True,黑井,False,False,True,昆明铁路局,云南省楚雄州禄丰县黑井镇黑井火车站
True,红果,True,True,True,昆明铁路局,贵州省六盘水市盘县红果镇红果火车站
True,建水,False,False,True,昆明铁路局,云南省红河州建水县工业园区工业大道中段建水火车站
True,鹿芒,False,False,False,青藏铁路公司,青海省海西州天峻县
True,洛北,False,False,False,青藏铁路公司,青海省海西州乌兰县
True,南山,False,False,False,青藏铁路公司,青海省海西州天峻县
True,鸟岛,False,False,False,青藏铁路公司,青海省海北州刚察县
True,欧龙山,False,False,False,青藏铁路公司,青海省海西州德令哈市怀头他拉镇
True,青海湖,False,False,False,青藏铁路公司,青海省海北州海晏县青海湖乡
True,陶力,False,False,False,青藏铁路公司,青海省海西州德令哈市
True,天峻,False,False,False,青藏铁路公司,青海省海西州天峻县
True,江西村,False,False,False,南宁铁路局,广西壮族自治区南宁市江西镇
True,金鸡村,False,False,False,南宁铁路局,广西壮族自治区南宁市江南区沙井镇
True,理家坪,False,False,False,南宁铁路局,湖南省双牌县理家坪火车站
True,龙伯屯,False,False,False,南宁铁路局,广西壮族自治区宁明县明江乡龙伯屯
True,天西,False,False,False,南宁铁路局,广西壮族自治区宁明县亭亮乡天西村公所
,,,,,,
True,安靖,False,False,True,成都铁路局,四川成都市郫县安靖镇雍渡村
True,安顺,False,False,True,成都铁路局,贵州省安顺市西秀区南华路1号
True,巴中,False,False,True,成都铁路局,四川省巴中市巴州区玉堂街道办事处北龛社区四社
True,白沙,False,False,True,成都铁路局,重庆市江津区白沙镇滩盘社区白沙火车站
True,安家庄,False,False,False,北京铁路局,北京市门头沟区王平镇安家庄火车站
True,白旗,False,False,False,北京铁路局,河北省承德市滦平县红旗镇北白旗村
True,板城,False,False,False,北京铁路局,河北省保定市涞水县赵各庄镇板城火车站
True,暴河,False,False,False,北京铁路局,河北省承德市平泉县康杖子村暴河乘降所
True,北仓,False,False,False,北京铁路局,天津市北辰区
True,北舍,False,False,False,北京铁路局,山西省潞城市翟店乡北舍村
True,北塘,False,False,False,北京铁路局,天津市塘沽区新北路
True,八家子,False,False,False,呼和浩特铁路局,内蒙古自治区赤峰市阿鲁科尔沁旗天山口镇八家子村线路所
True,八苏木,False,False,False,呼和浩特铁路局,内蒙古自治区乌兰察布市卓资县
True,巴彦郭勒,False,False,False,呼和浩特铁路局,内蒙古自治区锡林郭勒盟苏尼特右旗
True,坝梁,False,False,False,呼和浩特铁路局,内蒙古自治区包头市固阳县西斗铺乡
True,白彦花,False,False,False,呼和浩特铁路局,内蒙古自治区巴彦淖尔市乌拉特前旗巴音花镇
True,白彦花站,False,False,False,呼和浩特铁路局,内蒙古自治区巴彦淖尔市乌拉特前旗巴音花镇
True,八达岭站,False,False,True,北京铁路局,北京市延庆县八达岭镇
True,霸州站,True,True,True,北京铁路局,河北省霸州市迎宾路火车站
True,安龙,False,False,True,南宁铁路局,贵州省安龙县德卧镇
True,百色,True,True,True,南宁铁路局,广西壮族自治区百色市城东二路3-4号
True,北海,False,False,True,南宁铁路局,广西壮族自治区北海市北京南路
True,北流,False,False,True,南宁铁路局,广西壮族自治区北流市北流镇鸭埌村
True,册亨,False,False,True,南宁铁路局,贵州省册亨县巧马镇
True,艾家村,False,False,False,兰州铁路局,宁夏回族自治区吴忠市同心县河西镇艾家村车站
True,八盘峡,False,False,False,兰州铁路局,甘肃省兰州市西固区河口镇八盘村八盘峡车站
True,白芨沟,False,False,False,兰州铁路局,宁夏回族自治区石嘴山市大武口区白芨沟车站
True,日喀则,True,True,True,青藏铁路公司,西藏自治区日喀则市
True,西宁,True,True,True,青藏铁路公司,青海省西宁市互助中路128号
True,西宁西,True,True,True,青藏铁路公司,青海省西宁市城北区大堡子乡
True,协荣,False,False,True,青藏铁路公司,西藏自治区拉萨市堆龙德庆县协荣乡
,,,,,,
True,阿城,True,True,True,哈尔滨铁路局,黑龙江省哈尔滨市阿城区会宁路61号
True,呼和浩特站,False,False,True,呼和浩特铁路局,内蒙古呼和浩特市新城区车站东街41号
True,化德站,False,False,True,呼和浩特铁路局,内蒙古自治区乌兰察布市化德县
True,集宁南,True,True,True,呼和浩特铁路局,内蒙古自治区乌兰察布市集宁区怀远北大街96号
True,经棚,False,False,True,呼和浩特铁路局,内蒙古自治区赤峰市克什克腾旗经棚镇经棚火车站
True,开鲁,False,False,True,呼和浩特铁路局,内蒙古自治区通辽市开鲁县火车站
True,林东,False,False,True,呼和浩特铁路局,内蒙古自治区赤峰市巴林左旗林东镇林东火车站
True,白银市,False,False,True,兰州铁路局,甘肃省白银市建设东路168号白银市车站
True,白银西,True,True,True,兰州铁路局,甘肃省白银市白银西车站
True,长征,False,False,True,兰州铁路局,甘肃省白银市平川区长征车站
True,大武口,False,False,True,兰州铁路局,宁夏回族自治区石嘴山市大武口区大武口车站
True,低窝铺,False,False,True,兰州铁路局,甘肃省甘肃矿区低窝铺车站
True,定边,False,False,True,兰州铁路局,陕西省榆林市定边县定边车站
True,民权,True,True,True,郑州铁路局,河南省商丘市民权县城和平西路
True,内乡,False,False,True,郑州铁路局,河南省内乡县
True,南阳,True,True,True,郑州铁路局,河南省南阳市卧龙区铁东街3号
True,南召,False,False,True,郑州铁路局,河南省南召县云阳镇
True,宁陵县,False,False,True,郑州铁路局,河南省商丘市宁陵县柳河镇
True,平顶山西,True,True,True,郑州铁路局,河南省宝丰县
True,沁阳,False,False,True,郑州铁路局,河南省沁阳市西万镇西万村
True,半截河,False,False,False,哈尔滨铁路局,黑龙江省佳木斯市汤原县鹤立镇
True,宝东,False,False,False,哈尔滨铁路局,黑龙江省虎林市宝东镇
True,北林,False,False,False,哈尔滨铁路局,黑龙江省穆棱市穆棱镇北林村
True,北头河,False,False,False,哈尔滨铁路局,内蒙古自治区牙克石市北头河村
True,碧水,False,False,False,哈尔滨铁路局,黑龙江省大兴安岭地区呼中区碧水镇
True,碧州,False,False,False,哈尔滨铁路局,黑龙江省大兴安岭地区新林区碧州镇
True,和硕,False,False,True,乌鲁木齐铁路局,新疆维吾尔自治区巴音郭楞蒙古自治州和硕县
True,和什托洛盖,False,False,True,乌鲁木齐铁路局,新疆农十师184团
True,和田,True,True,True,乌鲁木齐铁路局,新疆维吾尔自治区和田地区和田市北侧拉斯奎镇
True,霍尔果斯,True,True,True,乌鲁木齐铁路局,新疆维吾尔自治区伊犁哈萨克自治州霍城县六十二团
True,精河南,False,False,True,乌鲁木齐铁路局,新疆精河县
True,喀什,True,True,True,乌鲁木齐铁路局,新疆维吾尔自治区喀什地区喀什市
True,克拉玛依,True,True,True,乌鲁木齐铁路局,新疆维吾尔自治区克拉玛依市
True,布敦化,False,False,False,沈阳铁路局,内蒙古自治区科右中旗布敦化苏木布敦化镇
False,采石场,False,False,False,沈阳铁路局,吉林省安图县明月镇采石厂村
True,蚕厂屯,False,False,False,沈阳铁路局,辽宁省大连市金州区亮甲店镇蚕厂屯村
True,曹家营子,False,False,False,沈阳铁路局,内蒙古自治区赤峰市关家营乡曹家营子村
True,叉车厂,False,False,False,沈阳铁路局,辽宁省大连市甘井子区营城子镇
True,八角台,False,False,True,沈阳铁路局,辽宁省锦州市太和区兴隆街道
True,八面城,True,True,True,沈阳铁路局,辽宁省昌图县八面城镇站前委
True,八仙筒,True,True,True,沈阳铁路局,内蒙古自治区通辽市奈曼旗八仙筒镇
True,鲅鱼圈,False,False,True,沈阳铁路局,辽宁省营口市鲅鱼圈区熊岳城镇于园子村
True,白城,True,True,True,沈阳铁路局,吉林省白城市辽北路60号
True,白河,True,True,True,沈阳铁路局,吉林省安图县二道白河镇站前街站
True,革居,False,False,False,昆明铁路局,贵州省兴义市乌沙镇革居火车站
True,广南卫,False,False,False,昆明铁路局,云南省昆明市呈贡区广南卫火车站
True,红江,False,False,False,昆明铁路局,云南省楚雄州元谋县江边乡红江火车站
True,花家庄,False,False,False,昆明铁路局,贵州省盘县沙坡镇花家庄火车站
True,花棚子,False,False,False,昆明铁路局,四川省攀枝花市仁和区大龙潭乡花棚子村花棚子火车站
True,黄瓜园,False,False,False,昆明铁路局,云南省楚雄州元谋县黄瓜园镇黄瓜园火车站
True,洪洞,True,True,True,太原铁路局,山西省洪洞县车站街
True,洪洞西,False,False,True,太原铁路局,山西省洪洞县龙马乡辛庄村
True,侯马,True,True,True,太原铁路局,山西省侯马市新田路1号
True,侯马西,False,False,True,太原铁路局,山西省侯马市高村乡
True,怀仁,True,True,True,太原铁路局,山西省朔州市怀仁县火车站
True,怀仁东,False,False,True,太原铁路局,山西省朔州市怀仁县黎寨村东
True,霍州,True,True,True,太原铁路局,山西省霍州市城关镇
True,霍州东,False,False,True,太原铁路局,山西省霍州市李曹镇李曹村
True,江所田,False,False,True,昆明铁路局,云南省曲靖市罗平县板桥镇江所田火车站
True,昆明,True,True,True,昆明铁路局,云南省昆明市北京路南端南窑火车站
True,昆阳,False,False,True,昆明铁路局,云南省昆明市晋宁县昆阳镇昆阳火车站
True,丽江,False,False,True,昆明铁路局,云南省丽江市玉龙县黄山镇南口工业园区丽江火车站
True,鲁番,False,False,True,昆明铁路局,贵州省六盘水市盘县石桥镇鲁番村鲁番火车站
True,陆良,False,False,True,昆明铁路局,云南省曲靖市陆良县陆良火车站
True,禄丰南,False,False,True,昆明铁路局,云南省楚雄州禄丰县金山镇禄丰南火车站
True,天棚,False,False,False,青藏铁路公司,青海省海西州天峻县天棚乡
True,乌兰,False,False,False,青藏铁路公司,青海省海西州乌兰县
True,锡铁山,False,False,False,青藏铁路公司,青海省海西州德令哈市大柴旦镇
True,饮马峡,False,False,False,青藏铁路公司,青海省海西州德令哈市大柴旦镇
True,北碚,False,False,True,成都铁路局,重庆市北碚区龙凤一村
True,草海,False,False,True,成都铁路局,贵州省威宁县草海镇
True,长寿,False,False,True,成都铁路局,重庆市长寿区晏家镇石门村
True,长寿北,False,False,True,成都铁路局,重庆市长寿区渡舟镇
True,北屯,False,False,False,北京铁路局,河北省保定市涞源县北屯火车站
True,北宅,False,False,False,北京铁路局,北京市怀柔区桥梓镇北宅村
True,别山,False,False,False,北京铁路局,天津市蓟县别山镇
True,曹子里,False,False,False,北京铁路局,天津市武清区曹子里乡
True,常村,False,False,False,北京铁路局,山西省潞城市辛安泉镇常村
True,超梁沟,False,False,False,北京铁路局,河北省承德市隆化县隆化镇超梁沟村
True,白音库伦,False,False,False,呼和浩特铁路局,内蒙古自治区锡林郭勒盟锡林浩特市境内
True,白音特拉,False,False,False,呼和浩特铁路局,内蒙古自治区乌兰察布市化德县境内
True,白音乌拉,False,False,False,呼和浩特铁路局,内蒙古自治区赤峰市克什克腾旗经棚镇白土井子村白音乌拉火车站
True,白银哈尔,False,False,False,呼和浩特铁路局,内蒙古自治区锡林郭勒盟苏尼特右旗
True,白云鄂博南,False,False,False,呼和浩特铁路局,内蒙古自治区包头市白云区
True,半截店,False,False,False,呼和浩特铁路局,内蒙古自治区通辽市丰田镇半截店林场半截店火车站
True,宝木吐,False,False,False,呼和浩特铁路局,内蒙古自治区赤峰市巴林右旗巴彦塔拉苏木宝木吐村宝木吐火车站
True,白涧站,False,False,True,北京铁路局,河北省涞水县赵各庄镇
True,百里峡站,False,False,True,北京铁路局,河北省涞水县九龙镇苟各庄村
True,宝坻站,False,False,True,北京铁路局,天津市宝坻区火车站路1号
True,保定东站,False,False,True,北京铁路局,河北省保定市东风东路高铁保定东站
True,保定站,False,False,True,北京铁路局,河北省保定市新华路118号
True,岑溪,False,False,True,南宁铁路局,广西壮族自治区岑溪市站前大道
True,崇左,False,False,True,南宁铁路局,广西壮族自治区崇左市江南路45号
True,道州,False,False,True,南宁铁路局,湖南省道县营江乡百地头社区
True,东安东,False,False,True,南宁铁路局,湖南省东安县舜黄大道（天成实验学校对面）
True,防城港北,False,False,True,南宁铁路局,广西壮族自治区防城港市防城区金花茶大道
True,扶绥,False,False,True,南宁铁路局,广西壮族自治区扶绥县新华路206号
True,长城,False,False,False,兰州铁路局,甘肃省白银市景泰县草窝滩镇长城车站
True,长农,False,False,False,兰州铁路局,宁夏回族自治区中宁市同心县长山头乡长农车站
True,陈官营,False,False,False,兰州铁路局,甘肃省兰州市西固区陈坪乡陈官营车站
True,崇信,False,False,False,兰州铁路局,甘肃省平凉市崇信县铜城镇崇信车站
True,褚家湾,False,False,False,兰州铁路局,宁夏回族自治区中卫市海原县三河镇禇家湾车站
True,阿里河,True,True,True,哈尔滨铁路局,内蒙古自治区呼伦贝尔盟鄂伦春自治旗阿里河镇
True,阿龙山,True,True,True,哈尔滨铁路局,内蒙古自治区呼伦贝尔根河市阿龙山镇
True,阿木尔,False,False,True,哈尔滨铁路局,黑龙江省大兴安岭地区漠河县劲涛镇
True,安达,True,True,True,哈尔滨铁路局,黑龙江省安达市铁路街
True,安家,False,False,True,哈尔滨铁路局,黑龙江省五常市安家镇
True,昂昂溪,True,True,True,哈尔滨铁路局,黑龙江省齐齐哈尔市昂昂溪区陵园路23号
True,林西,False,False,True,呼和浩特铁路局,内蒙古自治区赤峰市林西县林西镇林西火车站
True,临河,True,True,True,呼和浩特铁路局,内蒙古自治区巴彦淖尔市临河区胜利南路临河火车站
True,旗下营,False,False,True,呼和浩特铁路局,内蒙古自治区乌兰察布市卓资县
True,萨拉齐,False,False,True,呼和浩特铁路局,内蒙古自治区包头市土右旗萨拉齐镇站前街1号
True,赛汉塔拉,False,False,True,呼和浩特铁路局,内蒙古自治区锡林郭勒盟苏尼特右旗赛汉塔拉镇赛汉塔拉火车站
True,桑根达来,False,False,True,呼和浩特铁路局,内蒙古自治区锡林郭勒盟正蓝旗桑根达来镇
True,定西,True,True,True,兰州铁路局,甘肃省定西市安定区交通路定西车站
True,敦煌,False,False,True,兰州铁路局,甘肃省敦煌市敦煌车站
True,甘谷,True,True,True,兰州铁路局,甘肃省天水市甘谷县新兴镇甘谷车站
True,皋兰,False,False,True,兰州铁路局,甘肃省兰州市皋兰县皋兰车站
True,高台,False,False,True,兰州铁路局,甘肃省张掖市高台县高台车站
True,古浪,False,False,True,兰州铁路局,甘肃省古浪县火车站路古浪车站
True,固原,True,True,True,兰州铁路局,宁夏回族自治区固原市原洲区东郊乡固原车站
True,瓜州,False,False,True,兰州铁路局,甘肃省瓜州县瓜州车站
True,汝州,False,False,True,郑州铁路局,河南省汝州市洗耳河办事处
True,三门峡,True,True,True,郑州铁路局,河南省三门峡市黄河路东5号
True,三门峡南,False,False,True,郑州铁路局,河南省三门峡市
True,三门峡西,True,True,True,郑州铁路局,河南省三门峡市陕县原店镇
True,商丘,True,True,True,郑州铁路局,河南省商丘市站前路59号
True,商丘南,True,True,True,郑州铁路局,河南省商丘市南京路东端
True,布苏里,False,False,False,哈尔滨铁路局,内蒙古自治区呼伦贝尔盟鄂伦春自治旗阿里河镇
True,长发屯,False,False,False,哈尔滨铁路局,黑龙江省佳木斯市长发屯镇
True,长缨,False,False,False,哈尔滨铁路局,黑龙江省大兴安岭地区漠河县劲涛镇
True,朝阳村,False,False,False,哈尔滨铁路局,内蒙古自治区呼伦贝尔盟鄂伦春自治旗乌鲁布铁镇
True,朝原,False,False,False,哈尔滨铁路局,内蒙古自治区根河市朝原村
True,朝中,False,False,False,哈尔滨铁路局,内蒙古自治区呼伦贝尔根河市
True,库车,True,True,True,乌鲁木齐铁路局,新疆维吾尔自治区阿克苏地区库车县
True,库尔勒,True,True,True,乌鲁木齐铁路局,新疆维吾尔自治区巴音郭楞蒙古自治州库尔勒市
True,奎屯,True,True,True,乌鲁木齐铁路局,新疆奎屯市
True,柳园,True,True,True,乌鲁木齐铁路局,甘肃省瓜州县柳园镇
True,柳园南,False,False,True,乌鲁木齐铁路局,甘肃省瓜州县柳园镇
True,茶条沟,False,False,False,沈阳铁路局,吉林省安图县石门镇
False,长春东,False,False,False,沈阳铁路局,吉林省长春市二道区惠工路38号
True,长虹（乙线）,False,False,False,沈阳铁路局,辽宁省凤城市鸡冠山镇
True,长山堡,False,False,False,沈阳铁路局,辽宁省清原县长山堡村
True,赤峰东,False,False,False,沈阳铁路局,内蒙古自治区赤峰市红山区城郊乡小房村
True,串子沟,False,False,False,沈阳铁路局,辽宁省兴城市郭家镇串子沟村
False,大甸,False,False,False,沈阳铁路局,辽宁省兴城市曹庄镇大甸村
True,白狼,False,False,True,沈阳铁路局,内蒙古自治区阿尔山市白狼镇
True,白泉,False,False,True,沈阳铁路局,吉林省东辽县东交大街157号
True,白山市,True,True,True,沈阳铁路局,吉林省白山市八道江区东兴街17号
True,白石山,False,False,True,沈阳铁路局,吉林省蛟河市白石山镇铁北街1号
True,白音胡硕,True,True,True,沈阳铁路局,内蒙古自治区兴安盟科尔沁右翼中旗白音胡硕镇
True,白音他拉,False,False,True,沈阳铁路局,内蒙古自治区通辽市奈曼旗白音他拉镇
True,宝龙山,False,False,True,沈阳铁路局,内蒙古自治区通辽市科左中旗宝龙山镇
True,保康,True,True,True,沈阳铁路局,内蒙古自治区通辽市科左中旗保康镇科尔沁大街
True,广州西,False,False,False,广铁集团,广东深广州市荔湾区西湾东路5号
True,锦和,False,False,False,广铁集团,湖南省麻阳县锦和镇
True,泸阳,False,False,False,广铁集团,湖南省中方县泸阳镇
True,马田墟,False,False,False,广铁集团,湖南省永兴县马田镇罗尾村
True,梅江,False,False,False,广铁集团,重庆市秀山县梅江镇
True,安化,False,False,True,广铁集团,湖南省安化县坪口镇
True,北滘,False,False,True,广铁集团,广东省广东省佛山市顺德区北滘镇西海村群力路与三乐路交叉口轻轨北滘站
True,八都,False,False,False,南昌铁路局,江西省吉水县八都镇
True,坂尾,False,False,False,南昌铁路局,福建省龙岩市新罗区雁石镇坂尾村
True,彬江,False,False,False,南昌铁路局,江西省宜春袁州区彬江镇三姑桥居委会
True,大深,False,False,False,南昌铁路局,福建省漳平市芦芝乡大深村
True,大洋洲,False,False,False,南昌铁路局,江西省新干县大洋州镇
True,阿寨,False,False,False,成都铁路局,四川省甘洛县玉田镇阿寨村
True,金马村,False,False,False,昆明铁路局,云南省昆明市官渡区阿拉乡金马村火车站
True,昆明西,False,False,False,昆明铁路局,云南省昆明市西山区昆明西火车站
True,拉鲊,False,False,False,昆明铁路局,四川省攀枝花市仁和区大龙潭乡拉鲊火车站
True,乐善村,False,False,False,昆明铁路局,云南省昆明市宜良县乐善村火车站
True,龙骨甸,False,False,False,昆明铁路局,云南省楚雄州禄丰县黒井镇龙骨甸火车站
True,龙塘坝,False,False,False,昆明铁路局,云南省楚雄州禄丰县妥安乡龙塘坝火车站
True,安仁,False,False,True,南昌铁路局,湖南省安仁县军山乡芙塘村
True,安溪,False,False,True,南昌铁路局,福建省泉州市安溪县城厢镇砖文村
