passenger,name,package,luggage,station,bureau,address
True,福山寺,False,False,False,北京铁路局,河北省唐山市滦县五店子镇
True,富庄子,False,False,False,北京铁路局,河北省唐山市丰润区沙流河镇
True,高各庄,False,False,False,北京铁路局,北京市顺义区牛栏山镇高各庄火车站
True,高寺台,False,False,False,北京铁路局,河北省承德市承德县高寺台镇营房村
True,贡家台　,False,False,False,北京铁路局,河北省深州市前磨头镇贡家台村　
True,叉车厂,False,False,False,沈阳铁路局,辽宁省大连市甘井子区营城子镇
True,茶条沟,False,False,False,沈阳铁路局,吉林省安图县石门镇
False,长春东,False,False,False,沈阳铁路局,吉林省长春市二道区惠工路38号
True,长虹（乙线）,False,False,False,沈阳铁路局,辽宁省凤城市鸡冠山镇
True,长山堡,False,False,False,沈阳铁路局,辽宁省清原县长山堡村
True,赤峰东,False,False,False,沈阳铁路局,内蒙古自治区赤峰市红山区城郊乡小房村
True,串子沟,False,False,False,沈阳铁路局,辽宁省兴城市郭家镇串子沟村
False,大甸,False,False,False,沈阳铁路局,辽宁省兴城市曹庄镇大甸村
True,高碑店东站,False,False,True,北京铁路局,河北省高碑店市方官镇庄夥村兴隆大街高碑店东站
True,高碑店站,True,True,True,北京铁路局,河北省高碑店市迎宾路1号
True,高邑西站,False,False,True,北京铁路局,河北省石家庄市高邑县站前街1号
True,高邑站,False,False,True,北京铁路局,河北省石家庄市高邑县凤中路新建大街53号
True,藁城站,False,False,True,北京铁路局,河北省石家庄藁城市迎宾大道西25号
True,官厅站,False,False,True,北京铁路局,河北省张家口市怀来县官厅镇
True,邯郸东站,False,False,True,北京铁路局,河北省邯郸市高开区高铁邯郸东站
True,小哨,False,False,False,昆明铁路局,云南省昆明市小哨镇小哨火车站
True,小新街,False,False,False,昆明铁路局,云南省嵩明县小新街镇小新街火车站
True,小月旧,False,False,False,昆明铁路局,云南省楚雄州元谋县老城乡小月旧火车站
True,新安,False,False,False,昆明铁路局,云南省曲靖市师宗县新安火车站
True,新江,False,False,False,昆明铁路局,四川省攀枝花市仁和区平地镇新江火车站
True,新坪田,False,False,False,昆明铁路局,贵州省兴义市威舍镇新坪田火车站
True,秧草地,False,False,False,昆明铁路局,云南省曲靖市师宗县秧草地火车站
True,高家村,False,False,False,呼和浩特铁路局,内蒙古自治区乌拉特前旗明安镇义和店村高家村组 
True,格日苏,False,False,False,呼和浩特铁路局,锡林郭勒正镶白旗城关镇北山村境内
True,公积坂,False,False,False,呼和浩特铁路局,内蒙古自治区包头市东河区
True,公主埂,False,False,False,呼和浩特铁路局,内蒙古自治区赤峰市克什克腾旗达尔罕苏木公主埂火车站
True,姑家堡,False,False,False,呼和浩特铁路局,内蒙古自治区乌兰察布市卓资县
True,孤山,False,False,False,呼和浩特铁路局,山西省大同市南郊区古店镇
True,古尔班,False,False,False,呼和浩特铁路局,内蒙古自治区锡林郭勒盟正镶白旗
True,古鲁满汉,False,False,False,呼和浩特铁路局,内蒙古自治区赤峰市巴林右旗巴彦塔拉苏木老道板嘎查古鲁满汉火车站
True,邓家湾,False,False,False,成都铁路局,云南省昭通市彝良县角奎镇大马村营盘组
True,东升坝,False,False,False,成都铁路局,重庆市綦江区篆塘镇东升坝车站
True,豆沙关,False,False,False,成都铁路局,云南省盐津县豆沙镇长胜村
True,渡口,False,False,False,成都铁路局,四川省攀枝花市东区长寿路
True,渡市,False,False,False,成都铁路局,四川省达州市达川区木头乡
True,尔赛河,False,False,False,成都铁路局,四川省越西县尓赛乡
True,二道桥,False,False,False,成都铁路局,云南省昭通市彝良县笋叶村
True,二道岩,False,False,False,成都铁路局,贵州省水城县蟠龙乡境内
True,禹城,False,False,True,济南铁路局,山东省德州市禹城市两站街9号
True,郓城,False,False,True,济南铁路局,山东省郓城县临城路西
True,枣庄,False,False,True,济南铁路局,山东省枣庄市新城区祁连山路
True,枣庄西,True,True,True,济南铁路局,山东省枣庄市薛城区临山路1号
True,章丘,True,True,True,济南铁路局,山东省章丘市双泉路与工业二路交汇口
True,诸城,False,False,True,济南铁路局,山东省诸城市舜王街道
True,庙庄,False,False,False,兰州铁路局,甘肃省平凉市崆峒区四十里铺镇庙庄车站
True,南河川,False,False,False,兰州铁路局,甘肃省天水市麦积区石佛乡南河川车站
True,暖泉,False,False,False,兰州铁路局,宁夏回族自治区银川市贺兰县暖泉车站
True,磐安镇,False,False,False,兰州铁路局,甘肃省天水市甘谷县磐安镇车站
True,彭阳,False,False,False,兰州铁路局,宁夏回族自治区固原市彭阳县古城乡（镇）彭阳车站
True,平凉南,False,False,False,兰州铁路局,甘肃省平凉市崆峒区新李村平凉南车站
True,平罗,False,False,False,兰州铁路局,宁夏回族自治区石嘴山市大武口区太沙镇平罗车站
True,平原堡,False,False,False,兰州铁路局,甘肃省张掖市甘州区平原堡镇平原堡车站
True,坡底下,False,False,False,兰州铁路局,甘肃省兰州市西固区东川乡坡底下车站
True,五原站,False,False,True,呼和浩特铁路局,内蒙古自治区巴彦淖尔市五原巴彦套海镇
True,西小召站,False,False,True,呼和浩特铁路局,内蒙古自治区巴彦淖尔市乌拉特前旗西小召镇
True,锡林浩特,False,False,True,呼和浩特铁路局,本站位于内蒙古自治区锡林浩特市
True,兴和西,False,False,True,呼和浩特铁路局,内蒙古自治区乌兰察布市兴和县城关镇
True,哲里木,False,False,True,呼和浩特铁路局,内蒙古自治区通辽市河西镇哲里木火车站
True,正镶白旗,False,False,True,呼和浩特铁路局,内蒙古自治区锡林郭勒盟正镶白旗明安图镇朝格温都尔开发区
True,朱日和,False,False,True,呼和浩特铁路局,内蒙古自治区锡林郭勒盟苏尼特右旗
True,卓资东,False,False,True,呼和浩特铁路局,内蒙古自治区乌兰察布市卓资县工业园区
True,中宁东,False,False,True,兰州铁路局,宁夏回族自治区中卫市中宁县新堡镇中宁东车站
True,中卫,True,True,True,兰州铁路局,宁夏回族自治区中卫市中卫车站
,,,,,,
True,万源,False,False,True,西安铁路局,四川省万源市火车站
True,韦庄,False,False,True,西安铁路局,陕西省渭南市澄城县韦庄镇南新街韦庄火车站
True,渭南,True,True,True,西安铁路局,陕西省渭南市临渭区城区
True,渭南北,False,False,True,西安铁路局,陕西省渭南市临渭区渭南北高铁火车站
True,渭南南,False,False,True,西安铁路局,陕西省渭南市临渭区河西乡
True,吴堡,False,False,True,西安铁路局,陕西省吴堡县宋家川镇张家焉村
True,武功,False,False,True,西安铁路局,陕西省咸阳市武功县人民路中段
True,商城,False,False,True,武汉铁路局,河南省商城县上石桥镇火车站开发区
True,沈丘,False,False,True,武汉铁路局,河南省沈丘县兆丰大道南端
True,十堰,True,True,True,武汉铁路局,湖北省十堰市车站路11号
True,松滋,False,False,True,武汉铁路局,湖北省松滋市麻水乡张家畈村
True,随州,False,True,True,武汉铁路局,湖北省随州市城东新区迎宾大道
True,遂平,False,False,True,武汉铁路局,河南省驻马店市遂平县城
True,庆盛,False,False,True,广铁集团,广东省广州市南沙区东涌镇庆盛村庆沙路88号
True,琼海,False,False,True,广铁集团,海南省琼海市爱华东路嘉积镇琼海火车站
True,饶平,False,False,True,广铁集团,广东省潮州市饶平县高堂镇
True,容桂,False,False,True,广铁集团,广东省广东省佛山市顺德区容桂街道扁滘村广珠城际铁路容桂轻轨站站
True,三水,False,False,True,广铁集团,广东省广东省佛山市三水区站前街1号
True,三亚,False,False,True,广铁集团,海南省三亚市育秀路10号三亚火车站
True,汕头,True,True,True,广铁集团,广东省汕头市泰山路61号
True,泰宁,False,False,True,南昌铁路局,福建省泰宁火车站（泰宁县杉城镇丰岩村丰元工业园区附近）
True,万年,False,False,True,南昌铁路局,江西省万年县陈应镇建明路1号
True,武夷山,True,True,True,南昌铁路局,福建省武夷山市综合农场站前路
True,峡江,False,False,True,南昌铁路局,江西省吉安市峡江县峡江火车站
True,霞浦,False,False,True,南昌铁路局,福建省霞浦县赤岸村
True,厦门,True,True,True,南昌铁路局,福建省厦门市厦禾路900号
True,厦门北,False,False,True,南昌铁路局,福建省厦门市集美区后溪镇岩内村
True,佳木斯,True,True,True,哈尔滨铁路局,黑龙江省佳木斯市站前路179号
True,建三江,False,False,True,哈尔滨铁路局,黑龙江农垦总局建三江分局站前路
True,江桥,False,False,True,哈尔滨铁路局,黑龙江省泰来县江桥镇江桥车站
True,姜家,False,False,True,哈尔滨铁路局,黑龙江省肇东市姜家镇
True,晋中,False,False,True,太原铁路局,山西省晋中市榆次区红马营村
True,岢岚,True,True,True,太原铁路局,山西省忻州市岢岚县振兴东街
True,临汾,True,True,True,太原铁路局,山西省临汾市尧都区车站街5号
True,临汾西,False,False,True,太原铁路局,山西省临汾市尧都区刘村镇周家庄村
True,灵丘,False,False,True,太原铁路局,山西省大同市灵丘县武灵镇新华街十四区
True,灵石东,False,False,True,太原铁路局,山西省灵石县马和乡张嵩村
True,灵石站,False,False,True,太原铁路局,山西省灵石县城车站路
True,米易,True,True,True,成都铁路局,四川省攀枝花市米易县攀莲镇顺达路19号
True,绵阳,True,True,True,成都铁路局,四川省绵阳市涪城区临园路西段62号
True,冕宁,False,False,True,成都铁路局,四川省凉山彝族自治州冕宁县泸沽镇交南路89号
True,内江,True,True,True,成都铁路局,四川省内江市市中区铁占街40号
True,南充,False,False,True,成都铁路局,四川省南充市顺庆区铁欣路1号
True,南川,False,False,True,成都铁路局,重庆市南川区南城街道金佛山社区南川火车站
True,攀枝花,True,True,True,成都铁路局,四川省攀枝花市仁和区金沙江大道东段2号—14号
True,绅坊站（客专）,False,False,True,上海铁路局,浙江省温州乐清市石帆街道绅坊村
True,永嘉站（客专）,False,False,True,上海铁路局,浙江省温州市永嘉县黄田街道千石村永嘉火车站
True,温州南站（客专）,False,False,True,上海铁路局,浙江省温州市瓯海区潘桥镇温州南站
True,瑞安站（客专）,False,False,True,上海铁路局,浙江省温州市瑞安市江南大道1号（南）
True,鳌江站（客专）,False,False,True,上海铁路局,浙江省温州市平阳县鳌江镇西塘村
True,苍南站（客专）,False,False,True,上海铁路局,浙江省温州市苍南县灵溪镇苍南火车站
True,本溪,True,True,True,沈阳铁路局,辽宁省本溪市平山区站前3号
True,本溪湖,False,False,True,沈阳铁路局,辽宁省本溪市溪湖区民主路站前街
True,布海,False,False,True,沈阳铁路局,吉林省德惠市布海乡
True,蔡家沟,False,False,True,沈阳铁路局,吉林省松原市扶余县蔡家沟镇道西街
True,苍石,False,False,True,沈阳铁路局,辽宁省清原县红透山镇苍石村
True,草河口,False,False,True,沈阳铁路局,辽宁省本溪市本溪满族自治县草河口镇
True,草市,False,False,True,沈阳铁路局,辽宁省清原县草市镇市府路20号
True,大观岭,False,False,False,哈尔滨铁路局,黑龙江省穆棱市磨刀石镇
True,大良,False,False,False,哈尔滨铁路局,内蒙古自治区陈巴尔虎旗大良村
True,大民屯,False,False,False,哈尔滨铁路局,黑龙江省齐齐哈尔市水师营镇大民屯车站
True,大其拉哈,False,False,False,哈尔滨铁路局,内蒙古自治区牙克石市伊图里河镇大其拉哈林场
True,孤山口,False,False,False,北京铁路局,北京市房山区韩村河镇下中院村
True,官高,False,False,False,北京铁路局,北京市昌平区南邵镇官高村
True,官厅西,False,False,False,北京铁路局,河北省张家口市怀来县官厅镇
True,大东,False,False,False,沈阳铁路局,吉林省白山市江源区大阳岔镇大东村
True,大罕,False,False,False,沈阳铁路局,内蒙古自治区通辽市大罕镇
True,邯郸站,True,True,True,北京铁路局,河北省邯郸市邯山区车站街2号
True,衡水站,True,True,True,北京铁路局,河北省衡水市桃城区中心街1号
True,羊堡,False,False,False,昆明铁路局,云南省昆明市经开区羊堡火车站
True,羊臼河,False,False,False,昆明铁路局,云南省楚雄州牟定县安乐乡羊臼河火车站
True,羊尾哨,False,False,False,昆明铁路局,云南省曲靖市富源县羊尾哨火车站
True,郭尔奔敖包,False,False,False,呼和浩特铁路局,苏尼特右旗赛汗塔拉镇额苏木
True,哈达山,False,False,False,呼和浩特铁路局,内蒙古自治区赤峰市克什克腾旗经棚镇新庙乡哈达山村哈达山火车站
True,哈业胡同,False,False,False,呼和浩特铁路局,内蒙古自治区包头市九原区哈业胡同乡
True,汗苏鲁,False,False,False,呼和浩特铁路局,内蒙古自治区赤峰市克什克腾旗经棚镇绍布嘎梁村汗苏鲁火车站
True,峰洞,False,False,False,成都铁路局,贵州省独山县甲里镇
True,峰高铺,False,False,False,成都铁路局,重庆市荣昌县峰高街道办事处文化路59号
True,福溪,False,False,False,成都铁路局,四川省宜宾市高县月江镇莫顶村
True,干溪沟,False,False,False,成都铁路局,重庆市彭水县漆树村
True,甘家坝,False,False,False,成都铁路局,重庆市黔江区濯水镇濯水9组
True,淄博,True,True,True,济南铁路局,山东省淄博市张店区杏园东路1号
True,邹城,False,False,True,济南铁路局,山东省邹城市邾国街1号
,,,,,,
True,七营,False,False,False,兰州铁路局,宁夏回族自治区中卫市海原县七营镇七营车站
True,桥湾,False,False,False,兰州铁路局,甘肃省酒泉市瓜州县河东乡桥湾车站
True,桥西,False,False,False,兰州铁路局,甘肃省嘉峪关市桥西车站
True,庆阳山,False,False,False,兰州铁路局,内蒙古自治区巴盟自治洲阿拉善左旗县庆阳山车站
True,卓资山,False,False,True,呼和浩特铁路局,内蒙古自治区乌兰察布市卓资县
,,,,,,
True,西安,True,True,True,西安铁路局,陕西省西安市环城北路44号
True,西安北站,False,False,True,西安铁路局,陕西省西安市未央区尚新路西安北高铁火车站
True,西安南,True,True,True,西安铁路局,陕西省西安市长安区引镇
True,西乡,True,True,True,西安铁路局,陕西省汉中市西乡县城关镇
True,咸阳,True,True,True,西安铁路局,陕西省咸阳市渭城区抗战路
True,汤逊湖,False,False,True,武汉铁路局,湖北省武汉市洪山区东湖高新开发区
True,天门,False,False,True,武汉铁路局,湖北省天门市皂市镇红花堰村
True,天门南,False,False,True,武汉铁路局,湖北省天门市多祥镇天门工业园
True,土地堂东,False,False,True,武汉铁路局,湖北省咸宁市土地堂镇
True,乌龙泉南,False,False,True,武汉铁路局,湖北省武汉市江夏区
True,武昌,True,True,True,武汉铁路局,湖北省武汉市武昌区中山路642号
True,武当山,False,False,True,武汉铁路局,湖北省丹江口市六里坪镇
True,武汉,False,False,True,武汉铁路局,湖北省武汉市洪山区阳春湖畔
True,汕尾,False,False,True,广铁集团,广东省汕尾市东涌镇
True,韶关,False,False,True,广铁集团,广东省韶关市武江区西联武广韶关站？
True,韶关东,True,True,True,广铁集团,广东省韶关市浈江区站南路1号
True,韶山,False,False,True,广铁集团,湖南省韶山市清溪镇
True,邵东,False,False,True,广铁集团,湖南省邵东县两市镇
True,邵阳,True,True,True,广铁集团,湖南省邵阳市大祥区城南乡邵洲路
True,深圳,True,True,True,广铁集团,广东省深圳市罗湖区建设路1003号
True,厦门高崎,True,True,True,南昌铁路局,福建省厦门湖里区中埔高崎火车站
True,向塘,True,True,True,南昌铁路局,江西省南昌县向塘镇火车站
True,新干,False,False,True,南昌铁路局,江西省新干县善政路
True,新余,True,True,True,南昌铁路局,江西省新余市渝水区胜利北路1号
True,信丰,False,False,True,南昌铁路局,江西省信丰县嘉定镇
True,兴国,False,False,True,南昌铁路局,江西省兴国县潋江镇
True,金河,True,True,True,哈尔滨铁路局,内蒙古呼伦贝尔根河市金河镇
True,金山屯,False,False,True,哈尔滨铁路局,黑龙江省伊春市金山屯区铁路街
True,锦河,False,False,True,哈尔滨铁路局,黑龙江省黑河市锦河农场
True,九三,True,True,True,哈尔滨铁路局,黑龙江省嫩江县双山镇九三车站
True,峻德,False,False,True,哈尔滨铁路局,黑龙江省鹤岗市兴安区
True,康金井,False,False,True,哈尔滨铁路局,黑龙江省哈尔滨市呼兰区康金镇
True,柳林河,False,False,True,太原铁路局,山西省太原市尖草坪区峙头村北
True,柳林南,False,False,True,太原铁路局,山西省吕梁市柳林县龙门会村
True,芦家庄,False,False,True,太原铁路局,山西省寿阳县上湖乡芦家庄村
True,吕梁,False,False,True,太原铁路局,山西省吕梁市离石区王家沟乡下安村
True,宁武,True,True,True,太原铁路局,山西省忻州市宁武县外环路
True,平社,False,False,True,太原铁路局,山西省忻州市忻府区庄磨镇平社村
True,平旺,False,False,True,太原铁路局,山西省大同市南郊区老平旺乡
True,平型关,False,False,True,太原铁路局,山西省大同市灵丘县白崖台乡白崖台村
True,彭山,False,False,True,成都铁路局,四川省眉山市彭山县风鸣镇建设路366号
True,彭水,False,False,True,成都铁路局,重庆市彭水县长滩乡
True,彭州,False,False,True,成都铁路局,四川省彭州市西郊顾福桥社区西海西路路68号
True,绍兴站（既有）,True,True,True,上海铁路局,浙江省绍兴市车站路210号
True,余姚站（既有）,True,True,True,上海铁路局,浙江省余姚市火车站路1号
False,宁波东站（既有）,False,False,True,上海铁路局,浙江省宁波市江东区桑田路站前路1号
True,宁波站,True,True,True,上海铁路局,浙江省宁波市海曙区南站东路19号南广场（市委党校附近）
True,柴岗,False,False,True,沈阳铁路局,吉林省农安县哈拉海镇柴岗村
True,昌图,True,True,True,沈阳铁路局,辽宁省铁岭市昌图县站前街
True,昌图西,False,False,True,沈阳铁路局,辽宁省昌图县昌图镇二高地村
True,长春,True,True,True,沈阳铁路局,吉林省长春市长白路5号
True,长春南,False,False,True,沈阳铁路局,吉林省长春市朝阳区开运街3881号
True,大乌苏,False,False,False,哈尔滨铁路局,黑龙江省大兴安岭地区新林区大乌苏镇
True,大西,False,False,False,哈尔滨铁路局,黑龙江省七台河市勃利县杏树乡
True,大扬气,False,False,False,哈尔滨铁路局,黑龙江省大兴安岭地区松岭区大扬气镇
True,大杨树东,False,False,False,哈尔滨铁路局,内蒙古自治区呼伦贝尔盟鄂伦春自治旗大杨树镇
True,代马沟,False,False,False,哈尔滨铁路局,黑龙江省穆棱市磨刀石镇代马沟村
True,东宫,False,False,False,哈尔滨铁路局,内蒙古自治区陈巴尔虎旗东宫村
True,郭杖子,False,False,False,北京铁路局,河北省承德县下板城镇小郭杖子村
True,韩麻营,False,False,False,北京铁路局,河北省承德市隆化县韩麻营镇十八里汰村
True,汉沟镇,False,False,False,北京铁路局,天津市北辰区
True,和村,False,False,False,北京铁路局,河北省邯郸市峰峰矿区和村镇柏泗村
True,猴山,False,False,False,北京铁路局,河北省承德市滦平县虎什哈镇猴山村
False,大荒地,False,False,False,沈阳铁路局,辽宁省葫芦岛市南票区大荒地村
True,大口钦,False,False,False,沈阳铁路局,吉林省吉林市龙潭区大口钦镇站前路6号
True,大梨树,False,False,False,沈阳铁路局,吉林省磐石市烟筒山镇大梨树村
True,大栗子,False,False,False,沈阳铁路局,吉林省临江市大栗子镇
True,怀柔北站,False,False,True,北京铁路局,北京市怀柔区怀柔北站
True,怀柔站,False,False,True,北京铁路局,北京市怀柔区府前东街1号
True,黄村站,False,False,True,北京铁路局,北京市大兴区黄村镇林校路
True,蓟县站,False,False,True,北京铁路局,天津市蓟县城关镇火车站路1号
True,晋州站,False,False,True,北京铁路局,河北省石家庄晋州市沧石路南光明街1号
True,羊者窝,False,False,False,昆明铁路局,云南省曲靖市罗平县羊者窝火车站
True,杨林,False,False,False,昆明铁路局,云南省嵩明县杨林镇杨林火车站
True,姚安,False,False,False,昆明铁路局,云南省姚安县弥兴镇姚安火车站
True,宜耐,False,False,False,昆明铁路局,云南省昆明市石林县宜耐火车站
True,迤资,False,False,False,昆明铁路局,四川省攀枝花市仁和区大龙潭乡迤资火车站
True,尹地,False,False,False,昆明铁路局,云南省楚雄州元谋县老城乡尹地火车站
True,营街,False,False,False,昆明铁路局,贵州省六盘水市水城县营街镇发耳乡营街火车站
True,永丰营,False,False,False,昆明铁路局,云南省昆明市宜良县永丰营火车站
True,杭锦旗,False,False,False,呼和浩特铁路局,内蒙古自治区鄂尔多斯市杭锦旗
True,好鲁库,False,False,False,呼和浩特铁路局,内蒙古自治区赤峰市克什克腾旗好鲁库乡好鲁库火车站
True,浩音呼都格,False,False,False,呼和浩特铁路局,内蒙古自治区锡林郭勒盟正蓝旗赛音胡都嘎苏木浩音呼都格线路所
True,泔溪,False,False,False,成都铁路局,重庆市酉阳县泔溪镇泔溪村
True,高峰,False,False,False,成都铁路局,贵州省安顺市平坝（县）高峰（镇）
True,高峰,False,False,False,成都铁路局,贵州省贵安新区高峰镇黄猫村
True,高谷,False,False,False,成都铁路局,重庆市彭水县高谷镇陈家村
True,高炉子,False,False,False,成都铁路局,贵州省遵义市汇川区高坪镇联丰村新农组
True,高坪铺,False,False,False,成都铁路局,贵州省龙里县
True,高兴,False,False,False,成都铁路局,四川省华蓥市高兴镇八达路300号火车站
True,汝箕沟,False,False,False,兰州铁路局,宁夏回族自治区石嘴山市大武口区汝箕沟车站
True,三关口,False,False,False,兰州铁路局,宁夏回族自治区固原市泾源县嵩店乡三关口车站
True,三阳川,False,False,False,兰州铁路局,甘肃省天水市麦积区渭南镇乡三阳川车站
True,三营,False,False,False,兰州铁路局,宁夏回族自治区固原市原洲区三营镇三营车站
True,桑园子,False,False,False,兰州铁路局,甘肃省兰州市榆中县桑园子乡桑园子车站
True,沙坡头,False,False,False,兰州铁路局,宁夏回族自治区中卫市沙坡头区沙坡头车站
True,上腰墩,False,False,False,兰州铁路局,甘肃省武威市凉州区河东乡上腰墩车站
True,邵家堂,False,False,False,兰州铁路局,甘肃省兰州市皋兰县忠和乡水源村邵家堂车站
True,沈家河,False,False,False,兰州铁路局,宁夏回族自治区固原市原洲区东郊乡沈家河车站
True,咸阳秦都,False,False,True,西安铁路局,陕西省咸阳市玉泉西路中段咸阳秦都高铁火车站
True,小河镇,False,False,True,西安铁路局,陕西省安康市旬阳县小河镇东山村
True,兴平,False,False,True,西安铁路局,陕西省兴平市南关路西段
True,宣汉,False,False,True,西安铁路局,四川省宣汉县滑山村云寨居委
True,旬阳,False,False,True,西安铁路局,陕西省旬阳县刘湾区进站路
True,旬阳北,True,True,True,西安铁路局,陕西省旬阳县白柳镇
True,延安,True,True,True,西安铁路局,陕西省延安市宝塔区柳林路
True,阎良,True,True,True,西安铁路局,陕西省西安市阎良区胜利路北段
True,砚川,False,False,True,西安铁路局,陕西省商洛市商州区大荆镇
True,武穴,False,False,True,武汉铁路局,湖北省武穴市石佛寺镇火车站开发区
True,西平,False,False,True,武汉铁路局,河南省驻马店市西平县城
True,息县,False,False,True,武汉铁路局,河南省信阳市息县曹黄林乡
True,浠水,True,True,True,武汉铁路局,湖北省浠水县火车站
True,仙桃西,False,False,True,武汉铁路局,湖北省仙桃市三伏潭镇雷场村
True,咸宁北,False,False,True,武汉铁路局,咸宁市西北部咸安区官埠桥镇渡船村
True,咸宁东,False,False,True,武汉铁路局,湖北省咸宁市咸宁开发区
True,咸宁南,False,False,True,武汉铁路局,湖北省咸宁市温泉区
True,深圳北,False,False,True,广铁集团,广东省深圳市龙华新区民治街道民塘路
True,深圳东,False,False,True,广铁集团,广东省深圳市龙岗区布吉街道办吉华路94号
True,深圳坪山,False,False,True,广铁集团,广东省深圳市龙岗区坪山新区
True,深圳西,True,True,True,广铁集团,广东省深圳市南山区学府西路
True,神州,False,False,True,广铁集团,海南省万宁市礼纪镇莲花村
