passenger,name,package,luggage,station,bureau,address
True,铜陵北站（高铁）,False,False,True,上海铁路局,安徽省铜陵市铜陵县钟鸣镇
True,绩溪北站（高铁）,False,False,True,上海铁路局,安徽省绩溪县龙川大道与徽山大道交汇处
True,歙县北站（高铁）,False,False,True,上海铁路局,安徽省黄山市歙县富堨镇歙县北站
True,南陵站（高铁）,False,False,True,上海铁路局,安徽省南陵县三里镇牌楼村
True,泾县站（高铁）,False,False,True,上海铁路局,安徽省宣城市泾县泾川镇
True,旌德站（高铁）,False,False,True,上海铁路局,安徽省宣城市旌德县旌阳镇
True,永济,True,True,True,太原铁路局,山西省永济市迎新东街45号
True,永济北,False,False,True,太原铁路局,山西省永济市张营镇丰乐村北
True,榆次,True,True,True,太原铁路局,山西省晋中市榆次区迎宾街站南路471号
True,榆社,False,False,True,太原铁路局,山西省榆社县迎春南路168号
True,原平,True,True,True,太原铁路局,山西省原平市永兴南路23号
True,运城,True,True,True,太原铁路局,山西省运城市潞村街2号
True,运城北,False,False,True,太原铁路局,山西省运城市姚孟办事处陶上村
True,枣林站,False,False,True,太原铁路局,山西省代县枣林镇段村
True,三汇镇,False,False,True,成都铁路局,四川省达州市渠县三汇镇工矿区17号
True,沙坪坝,False,False,True,成都铁路局,重庆市沙坪坝区站东路
True,施秉,False,False,True,成都铁路局,贵州省施秉县杨柳塘镇屯上村
True,石柱县,False,False,True,成都铁路局,重庆市石柱县下路镇
True,双溪,False,False,True,成都铁路局,重庆市江北区鱼嘴镇双溪村
True,水富,False,False,True,成都铁路局,云南省昭通市水富县高滩坝
True,水江,False,False,True,成都铁路局,重庆市南川区水江镇水江火车站
True,遂宁,False,False,True,成都铁路局,四川省遂宁经济技术开发区明月路860号
True,桐子林,False,False,True,成都铁路局,四川省攀枝花市盐边县桐子林镇52号
True,三合庄,False,False,False,北京铁路局,北京市房山区张坊镇三合庄火车站
True,三平,False,False,False,北京铁路局,河北省三河市李旗庄镇
True,沙子河,False,False,False,北京铁路局,河北省唐山市滦县五店子镇
True,上安,False,False,False,北京铁路局,河北省井陉县上安西村
True,上仓,False,False,False,北京铁路局,天津市蓟县上仓乡
True,上谷,False,False,False,北京铁路局,河北省承德县上谷乡
True,上万,False,False,False,北京铁路局,北京市房山区青龙湖镇上万站
True,南园村,False,False,False,呼和浩特铁路局,内蒙古自治区包头市东河区
True,平安地,False,False,False,呼和浩特铁路局,内蒙古自治区通辽市开鲁县义和塔拉镇核心村平安地火车站
True,平顶庙,False,False,False,呼和浩特铁路局,内蒙古自治区赤峰市巴林右旗大板镇平顶庙火车站
True,七苏木,False,False,False,呼和浩特铁路局,内蒙古自治区乌兰察布市白海子乡
True,齐哈日格图,False,False,False,呼和浩特铁路局,格日勒敖都苏木齐哈日格图移民区    
True,旗下营东站,False,False,False,呼和浩特铁路局,内蒙古自治区乌兰察布市卓资县
True,萨拉齐东,False,False,False,呼和浩特铁路局,内蒙古自治区包头市土右旗萨拉齐镇
True,青县站,True,True,True,北京铁路局,河北省沧州市青县清州镇迎宾路72号
True,清河站,False,False,True,北京铁路局,北京市海淀区清河火车站
True,清华园站,False,False,True,北京铁路局,北京海淀区知春路大运村北航西门对面
True,饶阳站,False,False,True,北京铁路局,河北省衡水市饶阳县富强街186号
True,任丘站,True,True,True,北京铁路局,河北省任丘市渤海路1号
True,三河县站,False,False,True,北京铁路局,河北省廊坊三河市居安小区府东路南
True,三家店站,False,False,True,北京铁路局,北京市门头沟区三家店火车站
True,沙城站,True,True,True,北京铁路局,河北省张家口市怀来县沙城镇车站街1号
True,沙河市站,False,False,True,北京铁路局,河北省沙河市白云路12号
True,宣和,False,False,False,兰州铁路局,宁夏回族自治区中卫市宣和镇宣和车站
True,迎水桥,False,False,False,兰州铁路局,宁夏回族自治区中卫市沙坡头区西园乡迎水桥车站
True,营盘水,False,False,False,兰州铁路局,宁夏回族自治区中卫市西原镇营盘水车站
True,玉石,False,False,False,兰州铁路局,甘肃省金昌市永昌县河西堡镇玉石车站
True,鸳鸯镇,False,False,False,兰州铁路局,甘肃省天水市武山县鸳鸯镇车站
True,园墩,False,False,False,兰州铁路局,甘肃省武威市古浪县胡家边乡圆墩车站
True,岳家井,False,False,False,兰州铁路局,内蒙古自治区巴盟自治洲阿拉善左旗县岳家井车站
True,鹤岗,True,True,True,哈尔滨铁路局,黑龙江省鹤岗市向阳区老站路
True,鹤立,False,False,True,哈尔滨铁路局,黑龙江省佳木斯市汤原县鹤立镇忠诚街
True,黑河,True,True,True,哈尔滨铁路局,黑龙江省黑河市
True,黑台,False,False,True,哈尔滨铁路局,黑龙江省密山市黑台镇
True,横道河子,False,False,True,哈尔滨铁路局,黑龙江省海林市横道河子镇
True,红山,False,False,True,哈尔滨铁路局,黑龙江省伊春市
True,红兴隆,False,False,True,哈尔滨铁路局,黑龙江省双鸭山市友谊县兴隆镇
True,金沙岗,False,False,False,哈尔滨铁路局,黑龙江省双鸭山市四方台区
True,劲松,False,False,False,哈尔滨铁路局,黑龙江省大兴安岭地区松岭区劲松镇
True,静岭,False,False,False,哈尔滨铁路局,内蒙古自治区根河市静岭村
True,九营,False,False,False,哈尔滨铁路局,黑龙江省双鸭山市友谊县友邻乡
True,喀喇其,False,False,False,哈尔滨铁路局,内蒙古自治区呼伦贝尔盟鄂伦春自治旗克一河镇喀喇其林场
True,卡路屯,False,False,False,哈尔滨铁路局,黑龙江省牡丹江市西安区
True,开道,False,False,False,哈尔滨铁路局,黑龙江省尚志市鱼池乡开道村
True,凯北,False,False,False,哈尔滨铁路局,黑龙江省虎林市杨岗镇湖北村
True,宽沟,False,False,False,哈尔滨铁路局,黑龙江省绥芬河市阜宁镇宽沟村
False,琥珀湖,False,False,False,沈阳铁路局,辽宁省抚顺市李石经济开发区小瓦乡
True,花山,False,False,False,沈阳铁路局,吉林省临江市花山镇
True,桦皮厂,False,False,False,沈阳铁路局,吉林省吉林市昌邑区桦皮厂镇
True,桓龙湖,False,False,False,沈阳铁路局,辽宁省本溪市桓仁县黑沟乡六道沟村
True,荒沟西,False,False,False,沈阳铁路局,吉林省安图县松江镇荒沟林场
True,黄家店,False,False,False,沈阳铁路局,河北省围场县克勒沟镇围子村
True,黄甲屯,False,False,False,沈阳铁路局,辽宁省葫芦岛市南票区黄甲屯村
True,黄泥崴子,False,False,False,沈阳铁路局,吉林省抚松县黄泥崴子仙人桥镇黄泥崴子村
True,辉南,False,False,False,沈阳铁路局,吉林省辉南县辉南镇
True,兖州,True,True,True,济南铁路局,山东省兖州市酒仙桥北路64号
True,晏城,False,False,True,济南铁路局,山东省德州市齐河县金石大街16号
True,阳谷,False,False,True,济南铁路局,山东省阳谷县站前街
True,沂南,False,False,True,济南铁路局,山东省沂南县辛集镇
True,沂水,False,False,True,济南铁路局,山东省沂水县四十里镇
True,禹城,False,False,True,济南铁路局,山东省德州市禹城市两站街9号
True,郓城,False,False,True,济南铁路局,山东省郓城县临城路西
True,东通化,False,False,True,沈阳铁路局,吉林省通化市二道江区东通化大街16号
True,东辛庄,False,False,True,沈阳铁路局,辽宁省兴城市东辛庄镇东一街
True,杜家,False,False,True,沈阳铁路局,黑龙江省五常市杜家镇
True,敦化,True,True,True,沈阳铁路局,吉林省敦化市东环城路15号
True,二龙,False,False,True,沈阳铁路局,内蒙古自治区赤峰市宁城县汐子镇
True,二密河,False,False,True,沈阳铁路局,吉林省通化县二密河镇
True,范家屯,False,False,True,沈阳铁路局,吉林省公主岭市范家屯镇胜利街
True,凤凰城,True,True,True,沈阳铁路局,辽宁省凤城市凤山区苗可秀街
,,,,,,
True,渭南北,False,False,True,西安铁路局,陕西省渭南市临渭区渭南北高铁火车站
True,渭南南,False,False,True,西安铁路局,陕西省渭南市临渭区河西乡
True,吴堡,False,False,True,西安铁路局,陕西省吴堡县宋家川镇张家焉村
True,武功,False,False,True,西安铁路局,陕西省咸阳市武功县人民路中段
True,西安,True,True,True,西安铁路局,陕西省西安市环城北路44号
True,西安北站,False,False,True,西安铁路局,陕西省西安市未央区尚新路西安北高铁火车站
True,西安南,True,True,True,西安铁路局,陕西省西安市长安区引镇
True,西乡,True,True,True,西安铁路局,陕西省汉中市西乡县城关镇
True,商城,False,False,True,武汉铁路局,河南省商城县上石桥镇火车站开发区
True,沈丘,False,False,True,武汉铁路局,河南省沈丘县兆丰大道南端
True,十堰,True,True,True,武汉铁路局,湖北省十堰市车站路11号
True,松滋,False,False,True,武汉铁路局,湖北省松滋市麻水乡张家畈村
True,随州,False,True,True,武汉铁路局,湖北省随州市城东新区迎宾大道
True,遂平,False,False,True,武汉铁路局,河南省驻马店市遂平县城
True,汤逊湖,False,False,True,武汉铁路局,湖北省武汉市洪山区东湖高新开发区
True,娄底,True,True,True,广铁集团,湖南省娄底市娄星区氐星路
True,陆丰,False,False,True,广铁集团,广东省于陆丰市城东镇
True,路口铺,True,True,True,广铁集团,湖南省岳阳市
True,麻阳,False,False,True,广铁集团,湖南省怀化市麻阳县高村镇
True,茂名东,False,False,True,广铁集团,广东省茂名市站前五路
True,梅州,True,True,True,广铁集团,广东省梅州市彬芳南路
True,美兰,False,False,True,广铁集团,海南省海口市美兰区美兰机场海南航空交通管理站斜对面
True,汉王山,False,False,False,成都铁路局,四川省宜宾市高县月江镇川心村6组
True,河阳,False,False,False,成都铁路局,贵州省都匀市河阳乡
True,核桃园,False,False,False,成都铁路局,重庆市黔江区城南街道湘水村4组
True,横江,False,False,False,成都铁路局,四川省宜宾县横江镇和平村
True,红峰,False,False,False,成都铁路局,四川省喜德县乐武乡打洛村
True,红光镇,False,False,False,成都铁路局,四川省成都市郫县红光镇
True,红花塘,False,False,False,成都铁路局,四川省成都市青白江区龙王乡十六组
True,红花园,False,False,False,成都铁路局,贵州省桐梓县娄山关镇
True,洪安乡,False,False,False,成都铁路局,四川省成都市龙泉区洪安乡车站
True,上杭,False,False,True,南昌铁路局,福建省龙岩市上杭县蛟洋乡坪埔村
True,上饶,True,True,True,南昌铁路局,江西省上饶市信州区沙溪镇松山村
True,邵武,False,False,True,南昌铁路局,福建省邵武市解放中路344号
True,顺昌,False,False,True,南昌铁路局,福建省顺昌县双溪街道货场路1号
True,太姥山,False,False,True,南昌铁路局,福建省福鼎市秦屿镇
True,嘉兴站（既有）,True,True,True,上海铁路局,浙江省嘉兴市南湖区城东路179号
True,海宁站（既有）,True,True,True,上海铁路局,浙江省海宁市车站广场路1号
True,长兴南站（既有）,True,True,True,上海铁路局,浙江省湖州市长兴县金陵南路底
True,德清西站（既有）,False,False,True,上海铁路局,浙江省湖州市德清县永安街1号
True,松江南站（高铁）,False,False,True,上海铁路局,上海市松江区盐仓路
True,金山北站（高铁）,False,False,True,上海铁路局,上海市金山区兴豪路1288号
True,嘉善南站（高铁）,False,False,True,上海铁路局,浙江省嘉善县大云镇江家村
True,张兰站,False,False,True,太原铁路局,山西省介休市张兰镇
True,赵城,False,False,True,太原铁路局,山西省洪洞县赵城镇磨头村
True,镇城底,False,False,True,太原铁路局,山西省古交市镇城底镇
,,,,,,
True,桐梓,False,False,True,成都铁路局,贵州省桐梓县城关镇
True,潼南,False,False,True,成都铁路局,重庆市潼南县火车站
True,土溪,False,False,True,成都铁路局,四川省达州市渠县土溪镇先锋村4组
True,万州,False,False,True,成都铁路局,重庆市万州区站前路187号
True,旺苍,False,False,True,成都铁路局,四川省广元市旺苍县东河镇白马寺社区
True,武隆,False,False,True,成都铁路局,重庆市武隆县巷口镇芙蓉东路19号
True,西昌,True,True,True,成都铁路局,四川省凉山州西昌市袁家山迎宾路6号
True,什里店,False,False,False,北京铁路局,河北省武安市石洞乡什里店村
True,石郎庄,False,False,False,北京铁路局,河北省唐山市滦县榛子镇
True,双峰寺,False,False,False,北京铁路局,河北省承德市双桥区双峰寺镇三道河村
True,水洋,False,False,False,北京铁路局,山西省黎城县西仵乡水洋村
True,塔崖驿,False,False,False,北京铁路局,河北省涞源县塔崖驿乡塔崖驿村塔崖驿火车站
True,唐官屯,False,False,False,北京铁路局,天津市静海县唐官屯镇军民东路增1号
True,赛乌苏,False,False,False,呼和浩特铁路局,格日勒敖都苏木赛乌苏嘎查    
True,赛音胡都格,False,False,False,呼和浩特铁路局,内蒙古自治区锡林郭勒盟正蓝旗赛音胡都嘎苏木赛音胡都格火车站
True,三卜素,False,False,False,呼和浩特铁路局,内蒙古自治区土右旗
True,三道营,False,False,False,呼和浩特铁路局,内蒙古自治区乌兰察布市卓资县
True,三地,False,False,False,呼和浩特铁路局,内蒙古自治区赤峰市克什克腾旗热水开发区三地村三地火车站
True,三介海子站,False,False,False,呼和浩特铁路局,内蒙古自治区乌兰察布市商都县
True,三营图站,False,False,False,呼和浩特铁路局,内蒙古自治区乌兰察布市商都县
True,沙岭子站,False,False,True,北京铁路局,河北省张家口市宣化区沙岭子镇二里丰村
True,上板城南站,False,False,True,北京铁路局,河北省承德市开发新区上板城镇
True,上板城站,False,False,True,北京铁路局,河北省承德市双桥区开发新区卸甲营村
True,涉县站,True,True,True,北京铁路局,河北省邯郸市涉县迎宾街
True,深州站,False,False,True,北京铁路局,河北省衡水深州市桃源大街1号
True,云田乡,False,False,False,兰州铁路局,甘肃省定西市陇西县云田乡车站
True,张家祠,False,False,False,兰州铁路局,甘肃省兰州市红古区平安镇张家祠车站
True,中宁南,False,False,False,兰州铁路局,宁夏回族自治区中宁市同心县长山头乡中宁南车站
True,朱家窑,False,False,False,兰州铁路局,甘肃省兰州市皋兰县黑石乡朱家窑村朱家窑车站
,,,,,,
True,红星,False,False,True,哈尔滨铁路局,黑龙江省伊春市红星区团结街林铁委1号
True,红彦,False,False,True,哈尔滨铁路局,内蒙古自治区呼伦贝尔盟莫力达瓦达乌尔族自治旗红彦镇
True,洪河,False,False,True,哈尔滨铁路局,黑龙江省抚远市
True,呼兰,True,True,True,哈尔滨铁路局,黑龙江省哈尔滨市呼兰区
True,呼源,False,False,True,哈尔滨铁路局,黑龙江省大兴安岭地区呼中区呼源镇
True,喇嘛山,False,False,False,哈尔滨铁路局,内蒙古自治区牙克石市巴林镇喇嘛山车站
True,兰岭,False,False,False,哈尔滨铁路局,黑龙江省鸡西市滴道区兰岭乡
True,立志,False,False,False,哈尔滨铁路局,黑龙江省大庆市大同区太阳升镇立志村
True,连珠山,False,False,False,哈尔滨铁路局,黑龙江省密山市连珠山乡
True,岭北,False,False,False,哈尔滨铁路局,内蒙古自治区呼伦贝尔牙克石市图里镇
True,岭南,False,False,False,哈尔滨铁路局,内蒙古自治区呼伦贝尔牙克石市库都尔镇
True,火炬沟,False,False,False,沈阳铁路局,吉林省抚松县露水河镇清水河村
True,纪家,False,False,False,沈阳铁路局,吉林省辉南县团林镇纪家村
True,建北,False,False,False,沈阳铁路局,辽宁省建昌县牤牛营子乡
True,枣庄,False,False,True,济南铁路局,山东省枣庄市新城区祁连山路
True,枣庄西,True,True,True,济南铁路局,山东省枣庄市薛城区临山路1号
True,章丘,True,True,True,济南铁路局,山东省章丘市双泉路与工业二路交汇口
True,诸城,False,False,True,济南铁路局,山东省诸城市舜王街道
True,淄博,True,True,True,济南铁路局,山东省淄博市张店区杏园东路1号
True,邹城,False,False,True,济南铁路局,山东省邹城市邾国街1号
True,扶余,True,True,True,沈阳铁路局,吉林省扶余县西南街太祖路18号
True,扶余北,False,False,True,沈阳铁路局,吉林省松原市扶余市三岔河镇
True,抚顺北,True,True,True,沈阳铁路局,辽宁省抚顺市顺城区新华大街27号
True,阜新,True,True,True,沈阳铁路局,辽宁省阜新市海州区振兴路82号
True,嘎什甸子,False,False,True,沈阳铁路局,内蒙古自治区通辽市奈曼旗东明镇嘎什甸子村
True,盖州,True,True,True,沈阳铁路局,辽宁省盖州市站前街
True,盖州西,False,False,True,沈阳铁路局,辽宁省盖州市团山镇石屯村
True,咸阳,True,True,True,西安铁路局,陕西省咸阳市渭城区抗战路
True,咸阳秦都,False,False,True,西安铁路局,陕西省咸阳市玉泉西路中段咸阳秦都高铁火车站
True,小河镇,False,False,True,西安铁路局,陕西省安康市旬阳县小河镇东山村
True,兴平,False,False,True,西安铁路局,陕西省兴平市南关路西段
True,宣汉,False,False,True,西安铁路局,四川省宣汉县滑山村云寨居委
True,旬阳,False,False,True,西安铁路局,陕西省旬阳县刘湾区进站路
True,天门,False,False,True,武汉铁路局,湖北省天门市皂市镇红花堰村
True,天门南,False,False,True,武汉铁路局,湖北省天门市多祥镇天门工业园
True,土地堂东,False,False,True,武汉铁路局,湖北省咸宁市土地堂镇
True,乌龙泉南,False,False,True,武汉铁路局,湖北省武汉市江夏区
True,武昌,True,True,True,武汉铁路局,湖北省武汉市武昌区中山路642号
True,武当山,False,False,True,武汉铁路局,湖北省丹江口市六里坪镇
True,武汉,False,False,True,武汉铁路局,湖北省武汉市洪山区阳春湖畔
True,猛洞河,False,False,True,广铁集团,湖南省湘西自治州古丈县罗依溪镇
True,汨罗,False,False,True,广铁集团,湖南省汨罗市新站路
True,汨罗东,False,False,True,广铁集团,湖南省汨罗市龙舟南路？
True,明珠,False,False,True,广铁集团,广东省珠海市香洲区明珠北路35号
True,南朗,False,False,True,广铁集团,广东省中山市南朗镇佳朗路
True,南头,False,False,True,广铁集团,广东省中山市南头镇南头大道
True,侯家坪,False,False,False,成都铁路局,四川省资阳市雁江区松涛镇侯家坪社区
True,湖潮,False,False,False,成都铁路局,贵州省贵阳市花溪区湖潮镇
True,花龙门,False,False,False,成都铁路局,四川省成都市双流县胜利镇花龙村2组
True,花土坡,False,False,False,成都铁路局,贵州省威宁县中水镇黑土河乡新田村
True,泰和,False,False,True,南昌铁路局,江西省泰和县澄江镇
True,泰宁,False,False,True,南昌铁路局,福建省泰宁火车站（泰宁县杉城镇丰岩村丰元工业园区附近）
True,万年,False,False,True,南昌铁路局,江西省万年县陈应镇建明路1号
True,武夷山,True,True,True,南昌铁路局,福建省武夷山市综合农场站前路
True,嘉兴南站（高铁）,False,False,True,上海铁路局,浙江省嘉兴市南湖区余新镇黎明村双溪路
True,桐乡站（高铁）,False,False,True,上海铁路局,浙江省桐乡市高桥镇高桥大道51号（北）
True,海宁西站（高铁）,False,False,True,上海铁路局,浙江省海宁市许村镇人民大道1999号
True,余杭站（高铁）,False,False,True,上海铁路局,浙江省杭州市余杭区迎宾路号余杭高铁（南）
True,长兴站（高铁）,False,False,True,上海铁路局,浙江省长兴县太湖街道高铁路668号
True,湖州站（高铁）,False,False,True,上海铁路局,浙江省湖州市吴兴区西塞山路3636号（西）
True,西昌南,False,False,True,成都铁路局,四川省凉山州西昌市马道镇西路1号
True,息烽,False,False,True,成都铁路局,贵州省贵阳市息烽县永靖镇环城路？
True,犀浦,False,False,True,成都铁路局,四川省成都市郫县犀浦镇犀湖街88号
True,喜德,False,False,True,成都铁路局,四川省喜德县光明大道487号
True,秀山,False,False,True,成都铁路局,重庆市秀山县中和镇站前大道
True,盐津,False,False,True,成都铁路局,云南省盐津县黄毛坝白水村
True,燕岗,False,False,True,成都铁路局,四川省峨眉山市桂花桥镇前进北5号
True,统军庄,False,False,False,北京铁路局,北京市密云县十里堡镇统军庄村
True,王安镇,False,False,False,北京铁路局,河北省涞源县王安镇火车站
True,微子镇,False,False,False,北京铁路局,山西省潞城市微子镇乡
True,五道河,False,False,False,北京铁路局,河北省承德市滦平县安纯沟门乡五道河村平甸子自然村
True,午汲,False,False,False,北京铁路局,河北省武安市午汲镇行孝村
True,西大庙,False,False,False,北京铁路局,河北省承德市双桥区上板城镇西大庙村
True,下仓,False,False,False,北京铁路局,天津市蓟县下仓乡
True,桑根达来北,False,False,False,呼和浩特铁路局,内蒙古自治区锡林郭勒盟正蓝旗境内
True,桑根达来东,False,False,False,呼和浩特铁路局,内蒙古自治区锡林郭勒盟正蓝旗境内
True,沙沁塔拉,False,False,False,呼和浩特铁路局,内蒙古自治区赤峰市巴林右旗幸福之路苏木查干勿苏五队沙沁塔拉火车站
True,沙日乃,False,False,False,呼和浩特铁路局,内蒙古自治区赤峰市阿鲁科尔沁旗绍根苏木浩力宝嘎查沙日乃火车站
True,十渡站,False,False,True,北京铁路局,北京市房山区十渡镇十渡村
True,石家庄北站,False,False,True,北京铁路局,河北省石家庄市新华区市庄路265号
True,石家庄站,True,True,True,北京铁路局,河北省石家庄市桥西区京广西街
True,顺义站,False,False,True,北京铁路局,北京市顺义区站前北街17号
True,肃宁站,False,False,True,北京铁路局,河北省沧州市肃宁县站前街
False,唐山北站,False,False,True,北京铁路局,河北省唐山市丰润区迎宾路1号
True,呼中,False,False,True,哈尔滨铁路局,黑龙江省大兴安岭地区呼中区呼中镇
True,虎林,True,True,True,哈尔滨铁路局,黑龙江省虎林市虎林镇站前街1号
True,桦林,False,False,True,哈尔滨铁路局,黑龙江省牡丹江市阳明区桦林镇
True,桦南,True,True,True,哈尔滨铁路局,黑龙江省佳木斯市桦南县铁西街北段
True,换新天,False,False,True,哈尔滨铁路局,黑龙江农垦总局建三江分局创业农场
True,鸡东,True,True,True,哈尔滨铁路局,黑龙江省鸡东县鸡东镇振兴大街100号
True,鸡西,True,True,True,哈尔滨铁路局,黑龙江省鸡西市鸡冠区兴国中路138号
True,吉文,False,False,True,哈尔滨铁路局,内蒙古自治区呼伦贝尔盟鄂伦春自治旗吉文镇
True,陵丘,False,False,False,哈尔滨铁路局,内蒙古自治区陈巴尔虎旗陵丘村
True,柳毛,False,False,False,哈尔滨铁路局,黑龙江省鸡西市恒山区柳毛乡
True,柳树,False,False,False,哈尔滨铁路局,黑龙江省伊春市南岔区柳树经营所
True,龙船,False,False,False,哈尔滨铁路局,黑龙江省绥化市庆安县久胜镇
True,龙门河,False,False,False,哈尔滨铁路局,黑龙江省黑河市龙门农场
True,胪滨,False,False,False,哈尔滨铁路局,内蒙古自治区满洲里市泸滨村
True,鲁河,False,False,False,哈尔滨铁路局,黑龙江省龙江县鲁河乡鲁河车站
False,江家岭,False,False,False,沈阳铁路局,辽宁省绥中县荒地江家岭村
True,江密峰,False,False,False,沈阳铁路局,吉林省吉林市龙潭区江密峰镇江密峰街
True,金场堡,False,False,False,沈阳铁路局,辽宁省锦州市太和区女儿河乡金场堡村
False,金城,False,False,False,沈阳铁路局,辽宁省凌海市金城镇
True,金山湾,False,False,False,沈阳铁路局,辽宁省丹东市振安区金山村
True,金珠,False,False,False,沈阳铁路局,吉林省吉林市龙潭区金珠乡
True,卡伦,False,False,False,沈阳铁路局,吉林省长春市卡伦湖镇
,,,,,,
True,干沟,False,False,True,沈阳铁路局,吉林省通化县干沟村
True,甘旗卡,True,True,True,沈阳铁路局,内蒙古自治区通辽市科左后旗甘旗卡镇铁西路妈拉沁街
False,高岭,False,False,True,沈阳铁路局,辽宁省葫芦岛市绥中县高岭镇
True,高桥镇,False,False,True,沈阳铁路局,辽宁省葫芦岛市连山区高桥经济开发区
True,高山子,False,False,True,沈阳铁路局,辽宁省北镇市高山子镇
True,旬阳北,True,True,True,西安铁路局,陕西省旬阳县白柳镇
True,延安,True,True,True,西安铁路局,陕西省延安市宝塔区柳林路
True,阎良,True,True,True,西安铁路局,陕西省西安市阎良区胜利路北段
True,砚川,False,False,True,西安铁路局,陕西省商洛市商州区大荆镇
